"File","Path","Command","Class","Extends","Description","Purpose","IsSub","Category"
"add.command.ts","src\commands\moderation\forums\add.command.ts","add","ForumsAddCommand","SubCommand","Add a monitored forum for automatic replies (AI)","Add monitored forums for AI-powered automatic replies.","True","moderation"
"list.command.ts","src\commands\moderation\forums\list.command.ts","list","ForumsListCommand","SubCommand","List monitored forums","List monitored forums for AI-powered automatic replies.","True","moderation"
"parent.ts","src\commands\moderation\forums\parent.ts","forums","ForumsParentCommand","Command","Manage forums monitored by the AI","Configure AI-monitored forums.","False","moderation"
"remove.command.ts","src\commands\moderation\forums\remove.command.ts","remove","ForumsRemoveCommand","SubCommand","Remove a monitored forum","Remove a monitored forum for AI-powered automatic replies.","True","moderation"
"kick.ts","src\commands\moderation\kick.ts","kick","KickCommand","Command","Kick a user from the server","Register the ""moderation/kick"" command to offer the action consistently.","False","moderation"
"mute.ts","src\commands\moderation\mute.ts","mute","MuteCommand","Command","Mute a user (timeout)","Register the ""moderation/mute"" command to offer the action consistently.","False","moderation"
"add.command.ts","src\commands\moderation\rep\add.command.ts","add","RepAddCommand","SubCommand","Give reputation to a user","","True","moderation"
"config.command.ts","src\commands\moderation\rep\config.command.ts","keywords","RepConfigKeywordsCommand","SubCommand","Configure reputation keywords","","True","moderation"
"config.command.ts","src\commands\moderation\rep\config.command.ts","detection","RepConfigDetectionCommand","SubCommand","Configure automatic reputation detection","","True","moderation"
"parent.ts","src\commands\moderation\rep\parent.ts","rep","RepParentCommand","Command","Manage user reputation","Manage user reputation.","False","moderation"
"remove.command.ts","src\commands\moderation\rep\remove.command.ts","remove","RepRemoveCommand","SubCommand","Remove reputation from a user","","True","moderation"
"request.command.ts","src\commands\moderation\rep\request.command.ts","request","RepRequestCommand","SubCommand","Request a reputation review from the staff","","True","moderation"
"restrict.ts","src\commands\moderation\restrict.ts","restrict","RestrictCommand","Command","Restrict a user from forums and channels","Register the ""moderation/restrict"" command to offer the action consistently.","False","moderation"
"clear-limit.command.ts","src\commands\moderation\roles\clear-limit.command.ts","clear-limit","RoleClearLimitCommand","SubCommand","Delete the limit of an action","Remove a usage limit from a managed role.","True","moderation"
"control.command.ts","src\commands\moderation\roles\control.command.ts","control","RoleControlCommand","SubCommand","Configure moderation overrides","Configure moderation overrides for managed roles.","True","moderation"
"dashboard.command.ts","src\commands\moderation\roles\dashboard.command.ts","dashboard","RolesDashboardCommand","SubCommand","Visual dashboard to manage moderated roles","Visual dashboard for managing moderated roles.","True","moderation"
"list.command.ts","src\commands\moderation\roles\list.command.ts","list","RoleListCommand","SubCommand","List managed roles and their limits","List managed roles and their limits.","True","moderation"
"parent.ts","src\commands\moderation\roles\parent.ts","roles","RoleParentCommand","Command","Manage roles administered by the bot","Manage bot-administered roles.","False","moderation"
"remove.command.ts","src\commands\moderation\roles\remove.command.ts","remove","RoleRemoveCommand","SubCommand","Remove a managed role","Remove a managed role configuration.","True","moderation"
"set.command.ts","src\commands\moderation\roles\set.command.ts","set","RoleSetCommand","SubCommand","Register or update a managed role","Register or update a managed role configuration.","True","moderation"
"set-limit.command.ts","src\commands\moderation\roles\set-limit.command.ts","set-limit","RoleSetLimitCommand","SubCommand","Configure a usage limit for an action","Configure usage limits (rate limits) for moderation actions on managed roles.","True","moderation"
"closeAll.command.ts","src\commands\moderation\tickets\closeAll.command.ts","close-all","ConfigTicketsCommand","SubCommand","Close all open tickets in the server","Forcefully close and delete all active ticket channels in the guild.","True","moderation"
"config.command.ts","src\commands\moderation\tickets\config.command.ts","config","ConfigTicketsCommand","SubCommand","Configure the ticket system","Setup the ticket system channels and category.","True","moderation"
"parent.ts","src\commands\moderation\tickets\parent.ts","tickets","TicketsParent","Command","Configure and manage the tickets system","Configure and manage the tickets system.","False","moderation"
"config.command.ts","src\commands\moderation\tops\config.command.ts","config","ConfigTopsCommand","SubCommand","Configure the tops system","Enable and adjust the TOPs system per server.","True","moderation"
"parent.ts","src\commands\moderation\tops\parent.ts","tops","TopsParent","Command","Configure and manage the leaderboards system","","False","moderation"
"add.command.ts","src\commands\moderation\warn\add.command.ts","add","AddWarnCommand","SubCommand","Add a warning to a user","Add a warning to a user.","True","moderation"
"clear.command.ts","src\commands\moderation\warn\clear.command.ts","clear","ClearWarnCommand","SubCommand","Clear all warnings from a user","Clear all warnings for a user.","True","moderation"
"list.command.ts","src\commands\moderation\warn\list.command.ts","list","ListWarnCommand","SubCommand","View all warnings for a user","List all warnings for a user.","True","moderation"
"parent.ts","src\commands\moderation\warn\parent.ts","warn","WarnParent","Command","Manage user warnings","Register the parent command for user warnings.","False","moderation"
"remove.command.ts","src\commands\moderation\warn\remove.command.ts","remove","RemoveWarnCommand","SubCommand","Remove a warning from a user","Remove a specific warning from a user.","True","moderation"
"config.command.ts","src\commands\offers\config.command.ts","config","OfferConfigCommand","SubCommand","Configure the offers system","","True","offers"
"create.ts","src\commands\offers\create.ts","create","OfferCreateCommand","SubCommand","Create a new offer and send it for review","Create a new job offer and send it for review.","True","offers"
"edit.ts","src\commands\offers\edit.ts","edit","OfferEditCommand","SubCommand","Edit your active offer (returns to review)","Edit an active job offer using the embed designer.","True","offers"
"parent.ts","src\commands\offers\parent.ts","offer","OffersParent","Command","Manage moderated job offers","Register the parent command for job offer management.","False","offers"
"withdraw.ts","src\commands\offers\withdraw.ts","withdraw","OfferWithdrawCommand","SubCommand","Withdraw your active offer","Withdraw an active job offer from review.","True","offers"
"ping.ts","src\commands\ping.ts","ping","PingCommand","Command","Show latency with Discord","","False","ping.ts"
"cutdown.ts","src\commands\rpg\cutdown.ts","cutdown","CutDownCommand","Command","Cut down trees using your equipped axe","Gather wood from forests using equipped axe.","False","rpg"
"equip.command.ts","src\commands\rpg\equip.command.ts","equip","RpgEquipSubcommand","SubCommand","Equip an item from your inventory","Equip items from inventory to RPG equipment slots.","True","rpg"
"equip.command.ts","src\commands\rpg\equip.command.ts","rpg_equip_slot","RpgEquipSlotHandler","Command","Handle slot selection","","True","rpg"
"equip.command.ts","src\commands\rpg\equip.command.ts","rpg_equip_item","RpgEquipItemHandler","Command","Handle item selection for preview","","True","rpg"
"equip.command.ts","src\commands\rpg\equip.command.ts","rpg_equip_confirm","RpgEquipConfirmHandler","Command","Confirm and execute equip","","True","rpg"
"equip.command.ts","src\commands\rpg\equip.command.ts","rpg_equip_back","RpgEquipBackHandler","Command","Back to slot selection","","True","rpg"
"fight.ts","src\commands\rpg\fight.ts","fight","FightCommand","Command","RPG combat - challenge, accept, and fight other players","Challenge players to combat, accept fights, and submit moves.","False","rpg"
"loadout.ts","src\commands\rpg\loadout.ts","rpg-loadout","LoadoutCommand","Command","View your RPG equipment loadout","View your current equipment and loadout with stat totals.","True","rpg"
"mine.ts","src\commands\rpg\mine.ts","mine","MineCommand","Command","Mine for ores using your equipped pickaxe","Gather ores from mining locations using equipped pickaxe.","False","rpg"
"parent.ts","src\commands\rpg\parent.ts","rpg","RpgParentCommand","Command","RPG system - profile, equipment, gathering, and combat","Parent command for RPG system - profile, equipment, gathering.","False","rpg"
"process.ts","src\commands\rpg\process.ts","process","ProcessCommand","Command","Process raw materials into refined materials (2 raw -> 1 processed)","Process raw materials into refined materials.","False","rpg"
"profile.command.ts","src\commands\rpg\profile.command.ts","profile","RpgProfileSubcommand","SubCommand","Show your RPG profile with stats and equipment","Display RPG profile with loadout, stats, combat record, and HP.","True","rpg"
"unequip.command.ts","src\commands\rpg\unequip.command.ts","unequip","RpgUnequipSubcommand","SubCommand","Unequip an item from a slot","Remove equipped items and return them to inventory.","True","rpg"
"unequip.command.ts","src\commands\rpg\unequip.command.ts","rpg_unequip_slot","RpgUnequipSlotHandler","SubCommand","Handle slot button for unequip","","True","rpg"
"unequip.command.ts","src\commands\rpg\unequip.command.ts","rpg_unequip_confirm","RpgUnequipConfirmHandler","SubCommand","Confirm unequip","","True","rpg"
"unequip.command.ts","src\commands\rpg\unequip.command.ts","rpg_unequip_cancel","RpgUnequipCancelHandler","SubCommand","Cancel unequip","","True","rpg"
"upgrade-tool.ts","src\commands\rpg\upgrade-tool.ts","upgrade-tool","UpgradeToolCommand","Command","Upgrade a tool to the next tier with materials and money","Upgrade a tool to the next tier with materials and money.","False","rpg"
"rui-test.ts","src\commands\rui-test.ts","rui-test","RuiTestCommand","Command","reactive user interface test","","False","rui-test.ts"
"suggest.ts","src\commands\utility\suggest.ts","suggest","SuggestCommand","Command","Submit a suggestion for the server","Allow users to submit suggestions for the server.","False","utility"
